ID,Title,Body,Link,Site
link1,JFK wikipedia page,John F. kennedy wikipedia page.,http://en.wikipedia.org/wiki/John_F._Kennedy,personal1
link2,Lou gehrig,Lou gehrig wikipedia page.,http://en.wikipedia.org/wiki/Lou_Gehrig,project1
link3,A.L.S wikipedia page,A.L.S wikipedia page,http://en.wikipedia.org/wiki/Amyotrophic_lateral_sclerosis,project1
link4,The white hose,The white house home page,http://www.whitehouse.gov/,personal2
link5,Barak obama,Barak obama wikipedia page,http://en.wikipedia.org/wiki/Barak_obama,personal2
